{
  "schemaVersion": 1,
  "id": "zork1-upstream",
  "name": "Zork I microcomputer source collection",
  "origin": "third-party",
  "kind": "story-source",
  "importStatus": "not-imported",
  "upstream": {
    "url": "https://github.com/historicalsource/zork1",
    "revision": "97b7b3d68c075dd9af7da499c3e9690ada3471fd"
  },
  "license": {
    "spdx": "MIT",
    "sourceUrl": "https://github.com/historicalsource/zork1/blob/97b7b3d68c075dd9af7da499c3e9690ada3471fd/LICENSE",
    "localNoticePaths": []
  },
  "redistribution": {
    "decision": "eligible-after-audit",
    "trademarkGrant": false,
    "conditions": [
      "Audit the exact source and compiled artifact selected for distribution.",
      "Preserve the upstream Microsoft copyright and MIT license.",
      "Do not imply rights to names, logos, packaging, or marketing assets."
    ]
  },
  "localPaths": [],
  "verifiedAt": "2026-08-17",
  "notes": [
    "Research record for the source tree; no ZIL source has been imported.",
    "The byte-identical upstream COMPILED/zork1.z3 artifact is imported under the separate zork1-release-119-story record.",
    "A reproducible modern rebuild remains separate from the approved historical compiled artifact."
  ]
}
